{
	"$schema": "https://json-schema.org/draft/2020-12/schema",
	"$id": "super-plan.schema.json",
	"title": "Super Plan",
	"type": "object",
	"additionalProperties": false,
	"required": [
		"$schema",
		"planId",
		"featureName",
		"status",
		"source",
		"goal",
		"architectureSummary",
		"techStack",
		"executionMode",
		"reviewCadence",
		"agents",
		"branchStrategy",
		"worktree",
		"globalConstraints",
		"fileStructure",
		"requirementsChecklist",
		"taskDirectory",
		"rules",
		"tasks"
	],
	"properties": {
		"$schema": {
			"type": "string"
		},
		"planId": {
			"type": "string",
			"minLength": 1
		},
		"featureName": {
			"type": "string",
			"minLength": 1
		},
		"createdAt": {
			"type": "string",
			"format": "date-time"
		},
		"updatedAt": {
			"type": "string",
			"format": "date-time"
		},
		"status": {
			"type": "string",
			"enum": [
				"pending",
				"in_progress",
				"ready_for_review",
				"reviewing",
				"needs_fix",
				"blocked",
				"completed",
				"cancelled"
			]
		},
		"source": {
			"$ref": "#/$defs/source"
		},
		"goal": {
			"type": "string"
		},
		"architectureSummary": {
			"type": "string"
		},
		"techStack": {
			"type": "array",
			"items": {
				"type": "string"
			}
		},
		"executionMode": {
			"type": "string",
			"enum": ["subagent-driven", "sequential"]
		},
		"reviewCadence": {
			"type": "string",
			"enum": ["per_task", "per_batch", "final_only"]
		},
		"agents": {
			"$ref": "#/$defs/agentsConfig"
		},
		"branchStrategy": {
			"$ref": "#/$defs/branchStrategy"
		},
		"worktree": {
			"$ref": "#/$defs/worktree"
		},
		"globalConstraints": {
			"type": "array",
			"items": {
				"type": "string"
			}
		},
		"fileStructure": {
			"type": "array",
			"items": {
				"$ref": "#/$defs/fileStructureEntry"
			}
		},
		"requirementsChecklist": {
			"type": "array",
			"items": {
				"$ref": "#/$defs/requirement"
			}
		},
		"taskDirectory": {
			"type": "string",
			"minLength": 1
		},
		"rules": {
			"type": "array",
			"items": {
				"type": "string"
			}
		},
		"continuation": {
			"$ref": "#/$defs/continuation"
		},
		"tasks": {
			"type": "array",
			"items": {
				"$ref": "#/$defs/task"
			}
		}
	},
	"allOf": [
		{
			"if": {
				"properties": {
					"agents": {
						"$ref": "#/$defs/roleAgentsConfig"
					}
				},
				"required": ["agents"]
			},
			"then": {
				"properties": {
					"tasks": {
						"items": {
							"allOf": [
								{ "$ref": "#/$defs/task" },
								{
									"properties": {
										"task_profile": { "enum": ["general", "deep"] }
									}
								}
							]
						}
					}
				}
			}
		}
	],
	"$defs": {
		"continuation": {
			"type": "object",
			"additionalProperties": false,
			"required": ["enabled", "provider", "watchdogProfile", "status"],
			"properties": {
				"enabled": {"type": "boolean"},
				"provider": {"type": "string", "enum": ["codex"]},
				"watchdogProfile": {"type": "string", "minLength": 1},
				"status": {"type": "string", "enum": ["disabled", "active", "paused"]}
			}
		},
		"source": {
			"type": "object",
			"additionalProperties": false,
			"required": ["spec", "plan"],
			"properties": {
				"spec": {
					"type": "string",
					"minLength": 1
				},
				"plan": {
					"type": "string",
					"minLength": 1
				}
			}
		},
		"branchStrategy": {
			"type": "object",
			"additionalProperties": false,
			"required": ["baseBranch", "featureBranch"],
			"properties": {
				"baseBranch": {
					"type": "string",
					"minLength": 1
				},
				"featureBranch": {
					"type": "string",
					"minLength": 1
				}
			}
		},
		"agentProfile": {
			"type": "object",
			"additionalProperties": false,
			"required": ["model", "agent", "effort"],
			"properties": {
				"model": {
					"type": "string"
				},
				"agent": {
					"type": "string"
				},
				"effort": {
					"type": "string"
				}
			}
		},
		"agentsConfig": {
			"oneOf": [
				{
					"$ref": "#/$defs/roleAgentsConfig"
				},
				{
					"$ref": "#/$defs/legacyAgentsConfig"
				}
			]
		},
		"roleAgentsConfig": {
			"type": "object",
			"additionalProperties": false,
			"required": ["generalExecutor", "deepExecutor", "taskReviewer", "investigator", "specReviewer", "finalAuditor"],
			"properties": {
				"generalExecutor": {
					"$ref": "#/$defs/agentProfile"
				},
				"deepExecutor": {
					"$ref": "#/$defs/agentProfile"
				},
				"taskReviewer": {
					"$ref": "#/$defs/agentProfile"
				},
				"investigator": {
					"$ref": "#/$defs/agentProfile"
				},
				"specReviewer": {
					"$ref": "#/$defs/agentProfile"
				},
				"finalAuditor": {
					"$ref": "#/$defs/agentProfile"
				}
			}
		},
		"legacyAgentsConfig": {
			"type": "object",
			"additionalProperties": false,
			"required": ["general", "deep", "quick"],
			"properties": {
				"general": { "$ref": "#/$defs/agentProfile" },
				"deep": { "$ref": "#/$defs/agentProfile" },
				"quick": { "$ref": "#/$defs/agentProfile" }
			}
		},
		"worktree": {
			"type": "object",
			"additionalProperties": false,
			"required": ["enabled", "path"],
			"properties": {
				"enabled": {
					"type": "boolean"
				},
				"path": {
					"type": "string"
				}
			}
		},
		"fileStructureEntry": {
			"type": "object",
			"additionalProperties": false,
			"required": ["path", "ownerTask", "notes"],
			"properties": {
				"path": {
					"type": "string",
					"minLength": 1
				},
				"ownerTask": {
					"type": "string",
					"minLength": 1
				},
				"notes": {
					"type": "string"
				}
			}
		},
		"requirement": {
			"type": "object",
			"additionalProperties": false,
			"required": [
				"id",
				"title",
				"source",
				"status",
				"acceptanceCriteria",
				"coveredByTasks",
				"notes"
			],
			"properties": {
				"id": {
					"type": "string",
					"minLength": 1
				},
				"title": {
					"type": "string",
					"minLength": 1
				},
				"source": {
					"type": "string"
				},
				"status": {
					"type": "string",
					"enum": [
						"pending",
						"in_progress",
						"ready_for_review",
						"reviewing",
						"needs_fix",
						"blocked",
						"completed",
						"cancelled"
					]
				},
				"acceptanceCriteria": {
					"type": "array",
					"items": {
						"type": "string"
					}
				},
				"coveredByTasks": {
					"type": "array",
					"items": {
						"type": "string"
					}
				},
				"notes": {
					"type": "array",
					"items": {
						"type": "string"
					}
				}
			}
		},
		"task": {
			"type": "object",
			"additionalProperties": false,
			"allOf": [
				{
					"if": {
						"properties": {
							"status": {
								"enum": [
									"in_progress",
									"ready_for_review",
									"reviewing",
									"needs_fix",
									"completed"
								]
							}
						}
					},
					"then": {
						"properties": {
							"baseCommit": {
								"not": { "const": "pending" }
							}
						}
					}
				}
			],
			"required": [
				"id",
				"title",
				"description",
				"status",
				"tryCount",
				"maxTries",
				"task_profile",
				"batch",
				"layer",
				"reportFile",
				"reviewPackage",
				"progressLog",
				"logTaskScript",
				"baseCommit",
				"dependencies",
				"acceptanceCriteria",
				"requirements",
				"rules",
				"steps",
				"filesTouched",
				"files",
				"notes"
			],
			"properties": {
				"id": {
					"type": "string",
					"minLength": 1
				},
				"title": {
					"type": "string",
					"minLength": 1
				},
				"description": {
					"type": "string"
				},
				"status": {
					"type": "string",
					"enum": [
						"pending",
						"in_progress",
						"ready_for_review",
						"reviewing",
						"needs_fix",
						"blocked",
						"completed",
						"cancelled"
					]
				},
				"tryCount": {
					"type": "integer",
					"minimum": 1
				},
				"maxTries": {
					"type": "integer",
					"minimum": 1
				},
				"task_profile": {
					"type": "string",
					"enum": ["general", "deep", "quick"]
				},
				"batch": {
					"type": "string",
					"minLength": 1
				},
				"layer": {
					"type": "string",
					"enum": ["foundation", "core", "surface", "final"]
				},
				"reportFile": {
					"type": "string",
					"minLength": 1
				},
				"reviewPackage": {
					"type": "string",
					"minLength": 1
				},
				"progressLog": {
					"type": "string",
					"minLength": 1
				},
				"logTaskScript": {
					"type": "string",
					"minLength": 1
				},
				"baseCommit": {
					"type": "string",
					"minLength": 1,
					"description": "Required on every task; use pending during decomposition and replace it with the current HEAD immediately before dispatch."
				},
				"dependencies": {
					"type": "array",
					"items": {
						"type": "string"
					}
				},
				"acceptanceCriteria": {
					"type": "array",
					"items": {
						"type": "string"
					}
				},
				"requirements": {
					"type": "array",
					"items": {
						"type": "string"
					}
				},
				"rules": {
					"type": "array",
					"items": {
						"type": "string"
					}
				},
				"steps": {
					"type": "array",
					"items": {
						"$ref": "#/$defs/taskStep"
					}
				},
				"filesTouched": {
					"type": "array",
					"items": {
						"type": "string"
					}
				},
				"files": {
					"$ref": "#/$defs/taskFiles"
				},
				"notes": {
					"type": "array",
					"items": {
						"type": "string"
					}
				}
			}
		},
		"taskStep": {
			"type": "object",
			"additionalProperties": false,
			"required": [
				"order",
				"title",
				"description",
				"command",
				"expectedResult",
				"codeExample"
			],
			"properties": {
				"order": {
					"type": "integer",
					"minimum": 1
				},
				"title": {
					"type": "string",
					"minLength": 1
				},
				"description": {
					"type": "string"
				},
				"command": {
					"type": ["string", "null"]
				},
				"expectedResult": {
					"type": ["string", "null"]
				},
				"codeExample": {
					"type": ["string", "null"]
				}
			}
		},
		"taskFiles": {
			"type": "object",
			"additionalProperties": false,
			"required": ["created", "modified", "deleted"],
			"properties": {
				"created": {
					"type": "array",
					"items": {
						"type": "string"
					}
				},
				"modified": {
					"type": "array",
					"items": {
						"type": "string"
					}
				},
				"deleted": {
					"type": "array",
					"items": {
						"type": "string"
					}
				}
			}
		}
	}
}
