{
  "$schema": "https://raw.githubusercontent.com/gugacarbo/agents-skills/main/skills/super-planning/interfaces/super-plan.schema.json",
  "createdAt": "2026-07-17T00:28:01.821363+00:00",
  "planId": "0001-code-flow-adaptive-governance",
  "featureName": "code-flow-adaptive-governance",
  "status": "pending",
  "source": {
    "spec": "docs/specs/0001-code-flow-adaptive-governance.md",
    "plan": "docs/code-flow-changes-plan.md"
  },
  "goal": "",
  "architectureSummary": "",
  "techStack": [],
  "executionMode": "subagent-driven",
  "reviewCadence": "per_task",
  "agents": {
    "generalExecutor": {
      "model": "",
      "agent": "",
      "effort": ""
    },
    "deepExecutor": {
      "model": "",
      "agent": "",
      "effort": ""
    },
    "taskReviewer": {
      "model": "",
      "agent": "",
      "effort": ""
    },
    "investigator": {
      "model": "",
      "agent": "",
      "effort": ""
    },
    "specReviewer": {
      "model": "",
      "agent": "",
      "effort": ""
    },
    "finalAuditor": {
      "model": "",
      "agent": "",
      "effort": ""
    }
  },
  "branchStrategy": {
    "baseBranch": "main",
    "featureBranch": "main"
  },
  "worktree": {
    "enabled": false,
    "path": ""
  },
  "globalConstraints": [],
  "fileStructure": [],
  "requirementsChecklist": [],
  "taskDirectory": "docs/jobs/0001-code-flow-adaptive-governance",
  "rules": [],
  "continuation": {
    "enabled": false,
    "provider": "codex",
    "watchdogProfile": "default",
    "status": "disabled"
  },
  "tasks": []
}
